{
  "kind": "objective",
  "schema_version": "1.0.0",
  "objective_id": "obj_seed_affinity_web",
  "objective_version": "1.0.0",
  "tenant_id": "tenant_demo",
  "statement": "Find browsers resembling recent cooking-content readers",
  "task_family": "seed_affinity",
  "intended_use": "Planning audience for a food brand pilot",
  "requested_by": {
    "actor_id": "user_analyst_01",
    "actor_type": "human",
    "role": "analyst"
  },
  "claim_sought": "seed_affinity",
  "eligible_universe_ref": {
    "id": "universe_web_eligible",
    "version": "1.0.0"
  },
  "seed_ref": {
    "id": "seed_cooking_readers",
    "version": "1.0.0"
  },
  "content_brief_ref": null,
  "target": null
}
